PartyID,StateID,CandidateName,Gender,Age,PoliticalPartyName,DistrictName,LocalBodyName,WardNo,PostName,SerialNo,TotalVotesReceived,EStatus,Rank
1,1,तारा खरेल,महिला,47,नेपाल कम्युनिष्ट पार्टी (एकीकृत मार्क्सवादी-लेनिनवादी),तेर्हथुम,छथर गाउँपालिका,,उपाध्यक्ष,8687,3368,E,1
0,1,हीमा माया पौडेल भट्टराइ,महिला,33,नेपाली काँग्रेस,तेर्हथुम,छथर गाउँपालिका,,उपाध्यक्ष,8688,2489,,2
67,1,कोपिला कार्की,महिला,42,"नयाँ शक्ति पार्टी, नेपाल",तेर्हथुम,छथर गाउँपालिका,,उपाध्यक्ष,8689,20,,6
40,1,पवित्रा लिम्वु,महिला,27,संघीय लोकतान्त्रिक राष्ट्रिय मञ्च,तेर्हथुम,छथर गाउँपालिका,,उपाध्यक्ष,8690,202,,4
84,1,चुना खुलाल,महिला,35,स्वतन्त्र,तेर्हथुम,छथर गाउँपालिका,,उपाध्यक्ष,8691,58,,5
2,1,लिला माया सुब्बा,महिला,29,नेपाल कम्युनिष्ट पार्टी (माओवादी केन्द्र),तेर्हथुम,छथर गाउँपालिका,,उपाध्यक्ष,8692,701,,3
