PartyID,StateID,CandidateName,Gender,Age,PoliticalPartyName,DistrictName,LocalBodyName,WardNo,PostName,SerialNo,TotalVotesReceived,EStatus,Rank
1,2,रेणु देवी साह,महिला,49,नेपाल कम्युनिष्ट पार्टी (एकीकृत मार्क्सवादी-लेनिनवादी),सिराहा,सुखीपुर नगरपालिका,,उपप्रमुख,9723,6086,E,1
2,2,दिप नारायण यादव,पुरुष,38,नेपाल कम्युनिष्ट पार्टी (माओवादी केन्द्र),सिराहा,सुखीपुर नगरपालिका,,उपप्रमुख,9724,3354,,2
84,2,राम कुमारी देबी मंडल,महिला,49,स्वतन्त्र,सिराहा,सुखीपुर नगरपालिका,,उपप्रमुख,9725,0,,6
81,2,सुनिता यादव,महिला,28,राष्ट्रिय जनता पार्टी नेपाल,सिराहा,सुखीपुर नगरपालिका,,उपप्रमुख,9726,1175,,4
12,2,निलम देवी पासमान,महिला,29,नेपाल मजदुर किसान पार्टी ,सिराहा,सुखीपुर नगरपालिका,,उपप्रमुख,9727,10,,5
0,2,सुभद्रा देवी सुडी,महिला,51,नेपाली काँग्रेस,सिराहा,सुखीपुर नगरपालिका,,उपप्रमुख,9728,2518,,3
