PartyID,StateID,CandidateName,Gender,Age,PoliticalPartyName,DistrictName,LocalBodyName,WardNo,PostName,SerialNo,TotalVotesReceived,EStatus,Rank
1,5,झग बहादुर विश्‍वकर्मा,पुरुष,43,नेपाल कम्युनिष्ट पार्टी (एकीकृत मार्क्सवादी-लेनिनवादी),प्यूठान,सरुमारानी गाउँपालिका,,अध्यक्ष,39384,3677,E,1
2,5,डोर बहादुर दर्लामी मगर,पुरुष,47,नेपाल कम्युनिष्ट पार्टी (माओवादी केन्द्र),प्यूठान,सरुमारानी गाउँपालिका,,अध्यक्ष,39385,2241,,2
67,5,गमान सिं गुरुङ,पुरुष,49,"नयाँ शक्ति पार्टी, नेपाल",प्यूठान,सरुमारानी गाउँपालिका,,अध्यक्ष,39386,11,,5
84,5,कृण्ण बहादुर राना,पुरुष,41,स्वतन्त्र,प्यूठान,सरुमारानी गाउँपालिका,,अध्यक्ष,39387,106,,4
0,5,मोहन लाल पंथी,पुरुष,60,नेपाली काँग्रेस,प्यूठान,सरुमारानी गाउँपालिका,,अध्यक्ष,39388,1480,,3
