SerialNo,StateID,CandidateName,Gender,Age,PoliticalPartyName,DistrictName,CenterConstID,SCConstID,TotalVotesReceived,EStatus,Rank
2831,6,अम्मर बहादुर थापा,पुरुष,61,नेपाल कम्युनिष्ट पार्टी (एमाले),दैलेख,1,2,12567,Elected,1
2832,6,जगत जंग थापा,पुरुष,66,नेपाली काँग्रेस,दैलेख,1,2,10586,,2
2833,6,कर्ण बहादुर शाही,पुरुष,52,देशभक्त जनगणतान्त्रिक मोर्चा नेपाल,दैलेख,1,2,165,,3
2834,6,सुरत बहादुर रावत,पुरुष,47,राष्ट्रिय जनमोर्चा,दैलेख,1,2,155,,4
2835,6,दुर्ग बहादुर मगर,पुरुष,46,नेपाल मजदुर किसान पार्टी,दैलेख,1,2,96,,5
2836,6,चन्द्र बहादुर वुढा,पुरुष,64,नयाँ शक्ति पार्टी नेपाल,दैलेख,1,2,95,,6
