PartyID,StateID,CandidateName,Gender,Age,PoliticalPartyName,DistrictName,LocalBodyName,WardNo,PostName,SerialNo,TotalVotesReceived,EStatus,Rank
0,6,नन्द बहादुर सिंह,पुरुष,39,नेपाली काँग्रेस,कालिकोट,महावै गाउँपालिका,,अध्यक्ष,41257,1345,E,1
2,6,सर्प राज सिंह,पुरुष,53,नेपाल कम्युनिष्ट पार्टी (माओवादी केन्द्र),कालिकोट,महावै गाउँपालिका,,अध्यक्ष,41258,1276,,2
12,6,जयमणी तिरुवा,पुरुष,64,नेपाल मजदुर किसान पार्टी ,कालिकोट,महावै गाउँपालिका,,अध्यक्ष,41259,0,,6
1,6,दानकला सिंह,महिला,64,नेपाल कम्युनिष्ट पार्टी (एकीकृत मार्क्सवादी-लेनिनवादी),कालिकोट,महावै गाउँपालिका,,अध्यक्ष,41260,31,,4
67,6,दल बहादुर सिंह,पुरुष,41,"नयाँ शक्ति पार्टी, नेपाल",कालिकोट,महावै गाउँपालिका,,अध्यक्ष,41261,16,,5
3,6,रण बहादुर शाही,पुरुष,54,राष्ट्रिय प्रजातन्त्र पार्टी ,कालिकोट,महावै गाउँपालिका,,अध्यक्ष,41262,35,,3
