SerialNo,PartyID,StateID,CandidateName,Gender,Age,PoliticalPartyName,DistrictName,LocalBodyName,WardNo,PostName,TotalVotesReceived,EStatus,Rank
41257,0,6,नन्द बहादुर सिंह,पुरुष,39,नेपाली काँग्रेस,कालिकोट,महावै गाउँपालिका,,अध्यक्ष,1345,E,1
41258,2,6,सर्प राज सिंह,पुरुष,53,नेपाल कम्युनिष्ट पार्टी (माओवादी केन्द्र),कालिकोट,महावै गाउँपालिका,,अध्यक्ष,1276,,2
41259,12,6,जयमणी तिरुवा,पुरुष,64,नेपाल मजदुर किसान पार्टी ,कालिकोट,महावै गाउँपालिका,,अध्यक्ष,0,,6
41260,1,6,दानकला सिंह,महिला,64,नेपाल कम्युनिष्ट पार्टी (एकीकृत मार्क्सवादी-लेनिनवादी),कालिकोट,महावै गाउँपालिका,,अध्यक्ष,31,,4
41261,67,6,दल बहादुर सिंह,पुरुष,41,"नयाँ शक्ति पार्टी, नेपाल",कालिकोट,महावै गाउँपालिका,,अध्यक्ष,16,,5
41262,3,6,रण बहादुर शाही,पुरुष,54,राष्ट्रिय प्रजातन्त्र पार्टी ,कालिकोट,महावै गाउँपालिका,,अध्यक्ष,35,,3
