PartyID,StateID,CandidateName,Gender,Age,PoliticalPartyName,DistrictName,LocalBodyName,WardNo,PostName,SerialNo,TotalVotesReceived,EStatus,Rank
0,3,मञ्जु कुमारी के.सी.,महिला,43,नेपाली काँग्रेस,नुवाकोट,शिवपुरी गाउँपालिका,,उपाध्यक्ष,8153,3576,E,1
1,3,मंगल माया प्रजापती,महिला,48,नेपाल कम्युनिष्ट पार्टी (एकीकृत मार्क्सवादी-लेनिनवादी),नुवाकोट,शिवपुरी गाउँपालिका,,उपाध्यक्ष,8154,3573,,2
2,3,शुसिला थापा,महिला,56,नेपाल कम्युनिष्ट पार्टी (माओवादी केन्द्र),नुवाकोट,शिवपुरी गाउँपालिका,,उपाध्यक्ष,8155,2286,,3
46,3,दिपक राज के.सी.,पुरुष,34,देशभक्त पर्यावरणीय सामाजिक (देपसा) मोर्चा  ,नुवाकोट,शिवपुरी गाउँपालिका,,उपाध्यक्ष,8156,194,,4
67,3,पूजा तमाङ,महिला,25,"नयाँ शक्ति पार्टी, नेपाल",नुवाकोट,शिवपुरी गाउँपालिका,,उपाध्यक्ष,8157,8,,5
