SerialNo,StateID,CandidateName,Gender,Age,PoliticalPartyName,DistrictName,CenterConstID,SCConstID,TotalVotesReceived,EStatus,Rank
157,1,तुलसी प्रसाद न्यौपाने,पुरुष,60,नेपाल कम्युनिष्ट पार्टी (एमाले),संखुवासभा,1,2,17514,Elected,1
158,1,दीपक कुमार लिम्बु(थक्लुङ),पुरुष,46,नेपाली काँग्रेस,संखुवासभा,1,2,16140,,2
159,1,बद्री नारायण लिंथेप,पुरुष,48,संघीय समाजवादी फोरम नेपाल,संखुवासभा,1,2,201,,3
160,1,सुवास राई(याख्खा),पुरुष,55,संघीय लोकतान्त्रिक राष्ट्रिय मञ्च,संखुवासभा,1,2,183,,4
161,1,छत्र बहादुर थापा,पुरुष,60,एकीकृत राष्ट्रिय प्रजातन्त्र पार्टी(राष्ट्रवादी),संखुवासभा,1,2,134,,5
162,1,वीर वकस मगर,पुरुष,28,मंगोल नेशनल अर्गनाइजेसन,संखुवासभा,1,2,95,,6
163,1,टेक बहादुर विष्ट,पुरुष,55,नयाँ शक्ति पार्टी नेपाल,संखुवासभा,1,2,89,,7
164,1,याम कुमार लिंखा,पुरुष,32,राष्ट्रिय जनमुक्ति पार्टी,संखुवासभा,1,2,39,,8
