Age,CandidateName,DistrictName,EStatus,Gender,LocalBodyName,PoliticalPartyName,PostName,Rank,Remarks,SerialNo,TotalVotesRecieved,UCStatus,WardNo
48,कमला बस्‍नेत,दोलखा,E,महिला,भिमेश्वर नगरपालिका,नेपाल कम्युनिष्ट पार्टी (एकीकृत मार्क्सवादी-लेनिनवादी),उपप्रमुख,1,Elected,549,7017,N,
50,खेम बहादुर थापा क्षेत्री,दोलखा,,पुरुष,भिमेश्वर नगरपालिका,स्वतन्त्र,उपप्रमुख,5,,550,7,N,
28,कमला कार्की,दोलखा,,महिला,भिमेश्वर नगरपालिका,नेपाल कम्युनिष्ट पार्टी (माओवादी केन्द्र),उपप्रमुख,2,,551,2879,N,
47,राजन बहादुर शिवाकोटी,दोलखा,,पुरुष,भिमेश्वर नगरपालिका,राष्ट्रिय प्रजातन्त्र पार्टी,उपप्रमुख,3,,552,987,N,
28,लक्ष्मी फुयाल,दोलखा,,महिला,भिमेश्वर नगरपालिका,"नयाँ शक्ति पार्टी, नेपाल",उपप्रमुख,4,,553,53,N,