PartyID,StateID,CandidateName,Gender,Age,PoliticalPartyName,DistrictName,LocalBodyName,WardNo,PostName,SerialNo,TotalVotesReceived,EStatus,Rank
1,7,प्रेम कुमारी थापा,महिला,46,नेपाल कम्युनिष्ट पार्टी (एकीकृत मार्क्सवादी-लेनिनवादी),कैलाली,घोडाघोडी नगरपालिका,,उपप्रमुख,52063,7234,E,1
2,7,दुर्गा चलाउने (खडका),महिला,31,नेपाल कम्युनिष्ट पार्टी (माओवादी केन्द्र),कैलाली,घोडाघोडी नगरपालिका,,उपप्रमुख,52064,7019,,2
0,7,हेम वहादुर वम,पुरुष,56,नेपाली काँग्रेस,कैलाली,घोडाघोडी नगरपालिका,,उपप्रमुख,52065,5794,,3
9,7,मेनुका खड्का,महिला,39,राष्ट्रिय जनमोर्चा ,कैलाली,घोडाघोडी नगरपालिका,,उपप्रमुख,52066,63,,8
5,7,चेती देवी विश्‍कर्मा,महिला,41,"मधेशी जनअधिकार फोरम, नेपाल (लोकतान्त्रिक)",कैलाली,घोडाघोडी नगरपालिका,,उपप्रमुख,52067,1618,,5
3,7,सम्पदा शाही,महिला,26,राष्ट्रिय प्रजातन्त्र पार्टी ,कैलाली,घोडाघोडी नगरपालिका,,उपप्रमुख,52068,1309,,6
8,7,सीता कुमारी थारु,महिला,40,नेपाल कम्युनिष्ट पार्टी (मार्क्सवादी–लेनिनवादी),कैलाली,घोडाघोडी नगरपालिका,,उपप्रमुख,52069,123,,7
4,7,शुसिला चौधरी,महिला,38,"संघीय समाजवादी फोरम, नेपाल ",कैलाली,घोडाघोडी नगरपालिका,,उपप्रमुख,52070,2409,,4
