SerialNo,StateID,CandidateName,Gender,Age,PoliticalPartyName,DistrictName,CenterConstID,TotalVotesReceived,EStatus,Rank
1691,6,गजेन्द्र बहादुर महत,पुरुष,49,नेपाल कम्युनिष्ट पार्टी (माओवादी केन्द्र),जुम्ला,1,22173,Elected,1
1692,6,देबेन्द्र बहादुर शाही,पुरुष,55,नेपाली काँग्रेस,जुम्ला,1,14149,,2
1693,6,डिल्ली प्रसाद काफ्ले,पुरुष,56,नेपाल मजदुर किसान पार्टी,जुम्ला,1,2718,,3
1694,6,विन बुढा,पुरुष,56,एकीकृत राष्ट्रिय प्रजातन्त्र पार्टी(राष्ट्रवादी),जुम्ला,1,380,,4
1695,6,अमित कुमार शाही,पुरुष,29,संघीय समाजवादी फोरम नेपाल,जुम्ला,1,159,,5
1696,6,हरिहर चौलागाई,पुरुष,32,स्वतन्त्र,जुम्ला,1,152,,6
