SerialNo,PartyID,StateID,CandidateName,Gender,Age,PoliticalPartyName,DistrictName,LocalBodyName,WardNo,PostName,TotalVotesReceived,EStatus,Rank
23620,0,4,चन्द्र माया गुरुङ,महिला,41,नेपाली काँग्रेस,गोरखा,अजिरकोट गाउँपालिका,,उपाध्यक्ष,3030,E,1
23621,2,4,अनिता भुजेल,महिला,32,नेपाल कम्युनिष्ट पार्टी (माओवादी केन्द्र),गोरखा,अजिरकोट गाउँपालिका,,उपाध्यक्ष,2642,,2
23622,1,4,गीता कुमारी पोखरेल (योगी),महिला,36,नेपाल कम्युनिष्ट पार्टी (एकीकृत मार्क्सवादी-लेनिनवादी),गोरखा,अजिरकोट गाउँपालिका,,उपाध्यक्ष,357,,3
23623,67,4,सीता पोखरेल,महिला,41,"नयाँ शक्ति पार्टी, नेपाल",गोरखा,अजिरकोट गाउँपालिका,,उपाध्यक्ष,150,,4
23624,3,4,मधु माया दवाडी,महिला,44,राष्ट्रिय प्रजातन्त्र पार्टी ,गोरखा,अजिरकोट गाउँपालिका,,उपाध्यक्ष,50,,5
