PartyID,StateID,CandidateName,Gender,Age,PoliticalPartyName,DistrictName,LocalBodyName,WardNo,PostName,SerialNo,TotalVotesReceived,EStatus,Rank
0,1,विश्व नाथ निरौला,पुरुष,57,नेपाली काँग्रेस,खोटाङ्ग,ऐसेलुखर्क गाउँपालिका,,अध्यक्ष,20632,2131,E,1
1,1,गृह बहादुर राई (नाछिरिङ ),पुरुष,52,नेपाल कम्युनिष्ट पार्टी (एकीकृत मार्क्सवादी-लेनिनवादी),खोटाङ्ग,ऐसेलुखर्क गाउँपालिका,,अध्यक्ष,20633,1735,,2
20,1,गुण राज राई,पुरुष,35,"खम्वुवान राष्ट्रिय मोर्चा, नेपाल ",खोटाङ्ग,ऐसेलुखर्क गाउँपालिका,,अध्यक्ष,20634,44,,6
67,1,अगम सिंह राई,पुरुष,39,"नयाँ शक्ति पार्टी, नेपाल",खोटाङ्ग,ऐसेलुखर्क गाउँपालिका,,अध्यक्ष,20635,78,,4
3,1,भुप दास राजभण्डारी,पुरुष,56,राष्ट्रिय प्रजातन्त्र पार्टी ,खोटाङ्ग,ऐसेलुखर्क गाउँपालिका,,अध्यक्ष,20636,61,,5
2,1,श्री बहादुर राई,पुरुष,52,नेपाल कम्युनिष्ट पार्टी (माओवादी केन्द्र),खोटाङ्ग,ऐसेलुखर्क गाउँपालिका,,अध्यक्ष,20637,1396,,3
