SerialNo,StateID,CandidateName,Gender,Age,PoliticalPartyName,DistrictName,CenterConstID,SCConstID,TotalVotesReceived,EStatus,Rank
182,1,राजेन्द्र कुमार राई,पुरुष,47,नेपाल कम्युनिष्ट पार्टी (एमाले),भोजपुर,1,1,19297,Elected,1
183,1,अजम्बर राई काङमाङ,पुरुष,49,संघीय समाजवादी फोरम नेपाल,भोजपुर,1,1,11541,,2
184,1,पर्शु राम राई,पुरुष,34,जनसमाजवादी पार्टी नेपाल,भोजपुर,1,1,747,,3
185,1,आङ्गडेण्डी शेर्पा,पुरुष,32,देशभक्त जनगणतान्त्रिक मोर्चा नेपाल,भोजपुर,1,1,551,,4
186,1,मोजेज  राई ,पुरुष,26,मंगोल नेशनल अर्गनाइजेसन,भोजपुर,1,1,229,,5
187,1,सुवास राई,पुरुष,31,राष्ट्रिय जनता पार्टी नेपाल,भोजपुर,1,1,151,,6
188,1,उत्तम राई,पुरुष,33,संघीय लोकतान्त्रिक राष्ट्रिय मञ्च,भोजपुर,1,1,71,,7
