PartyID,StateID,CandidateName,Gender,Age,PoliticalPartyName,DistrictName,LocalBodyName,WardNo,PostName,SerialNo,TotalVotesReceived,EStatus,Rank
1,1,कृष्ण कुमारी पोखरेल,महिला,44,नेपाल कम्युनिष्ट पार्टी (एकीकृत मार्क्सवादी-लेनिनवादी),मोरङ्ग,लेटाङ नगरपालिका,,उपप्रमुख,14784,6809,E,1
0,1,सुभद्रा देवी भट्टराई,महिला,60,नेपाली काँग्रेस,मोरङ्ग,लेटाङ नगरपालिका,,उपप्रमुख,14785,5740,,2
3,1,सुमित्रा देवि दर्जी,महिला,29,राष्ट्रिय प्रजातन्त्र पार्टी ,मोरङ्ग,लेटाङ नगरपालिका,,उपप्रमुख,14786,54,,5
40,1,कृष्‍ण कुमार लिम्‍बु,पुरुष,44,संघीय लोकतान्त्रिक राष्ट्रिय मञ्च,मोरङ्ग,लेटाङ नगरपालिका,,उपप्रमुख,14787,652,,4
2,1,सन्त माया राई,महिला,47,नेपाल कम्युनिष्ट पार्टी (माओवादी केन्द्र),मोरङ्ग,लेटाङ नगरपालिका,,उपप्रमुख,14788,1295,,3
