SerialNo,StateID,CandidateName,Gender,Age,PoliticalPartyName,DistrictName,CenterConstID,TotalVotesReceived,EStatus,Rank
1840,7,झपट बहादुर रावल,पुरुष,42,नेपाल कम्युनिष्ट पार्टी (एमाले),कैलाली,2,25157,Elected,1
1841,7,मोहन सिंह राठौर,पुरुष,64,नेपाली काँग्रेस,कैलाली,2,23313,,2
1842,7,राम प्रसाद चौधरी,पुरुष,45,राष्ट्रिय जनता पार्टी नेपाल,कैलाली,2,5967,,3
1843,7,नृप बहादुर थ्यायत,पुरुष,37,नयाँ शक्ति पार्टी नेपाल,कैलाली,2,444,,4
1844,7,रमेश कुमार रावल,पुरुष,40,नेपाल मजदुर किसान पार्टी,कैलाली,2,299,,5
1845,7,मन बहादुर शाही,पुरुष,43,राष्ट्रिय जनमोर्चा,कैलाली,2,109,,6
