PartyID,StateID,CandidateName,Gender,Age,PoliticalPartyName,DistrictName,LocalBodyName,WardNo,PostName,SerialNo,TotalVotesReceived,EStatus,Rank
1,1,उर्मिला राई,महिला,46,नेपाल कम्युनिष्ट पार्टी (एकीकृत मार्क्सवादी-लेनिनवादी),पाँचथर,मिक्लाजुङ गाउँपालिका,,उपाध्यक्ष,1853,3506,E,1
2,1,जुनु कुमारी लावति,महिला,37,नेपाल कम्युनिष्ट पार्टी (माओवादी केन्द्र),पाँचथर,मिक्लाजुङ गाउँपालिका,,उपाध्यक्ष,1854,3114,,2
3,1,सबिना बराल,महिला,37,राष्ट्रिय प्रजातन्त्र पार्टी ,पाँचथर,मिक्लाजुङ गाउँपालिका,,उपाध्यक्ष,1855,153,,5
40,1,शुशिला मादेन,महिला,33,संघीय लोकतान्त्रिक राष्ट्रिय मञ्च,पाँचथर,मिक्लाजुङ गाउँपालिका,,उपाध्यक्ष,1856,244,,4
0,1,सुन माया राई,महिला,49,नेपाली काँग्रेस,पाँचथर,मिक्लाजुङ गाउँपालिका,,उपाध्यक्ष,1857,2650,,3
