SerialNo,PartyID,StateID,CandidateName,Gender,Age,PoliticalPartyName,DistrictName,LocalBodyName,WardNo,PostName,TotalVotesReceived,EStatus,Rank
12686,0,2,रंजु कुमारी साह,महिला,33,नेपाली काँग्रेस,धनुषा,नगराइन नगरपालिका,,उपप्रमुख,4849,E,1
12687,1,2,राधा देवी यादव,महिला,46,नेपाल कम्युनिष्ट पार्टी (एकीकृत मार्क्सवादी-लेनिनवादी),धनुषा,नगराइन नगरपालिका,,उपप्रमुख,4189,,2
12688,84,2,रितेश कुमार यादव,पुरुष,21,स्वतन्त्र,धनुषा,नगराइन नगरपालिका,,उपप्रमुख,0,,6
12689,81,2,गुलो देवी पासमान,महिला,44,राष्ट्रिय जनता पार्टी नेपाल,धनुषा,नगराइन नगरपालिका,,उपप्रमुख,695,,4
12690,2,2,रंजना देवी ठाकुर,महिला,33,नेपाल कम्युनिष्ट पार्टी (माओवादी केन्द्र),धनुषा,नगराइन नगरपालिका,,उपप्रमुख,677,,5
12691,4,2,रंजिता कुमारी पासवान,महिला,33,"संघीय समाजवादी फोरम, नेपाल ",धनुषा,नगराइन नगरपालिका,,उपप्रमुख,989,,3
