SerialNo,PartyID,StateID,CandidateName,Gender,Age,PoliticalPartyName,DistrictName,LocalBodyName,WardNo,PostName,TotalVotesReceived,EStatus,Rank
47331,0,7,ओम प्रकास विष्ट,पुरुष,66,नेपाली काँग्रेस,अछाम,कमलबजार नगरपालिका,,प्रमुख,3587,E,1
47332,1,7,दिपक प्रसाद अधिकारी,पुरुष,50,नेपाल कम्युनिष्ट पार्टी (एकीकृत मार्क्सवादी-लेनिनवादी),अछाम,कमलबजार नगरपालिका,,प्रमुख,3277,,2
47333,67,7,धन बहादुर थापा,पुरुष,44,"नयाँ शक्ति पार्टी, नेपाल",अछाम,कमलबजार नगरपालिका,,प्रमुख,24,,5
47334,12,7,जक्ती राम जैसी,पुरुष,54,नेपाल मजदुर किसान पार्टी ,अछाम,कमलबजार नगरपालिका,,प्रमुख,43,,4
47335,2,7,रण बहादुर विष्ट,पुरुष,37,नेपाल कम्युनिष्ट पार्टी (माओवादी केन्द्र),अछाम,कमलबजार नगरपालिका,,प्रमुख,491,,3
