SerialNo,PartyID,StateID,CandidateName,Gender,Age,PoliticalPartyName,DistrictName,LocalBodyName,WardNo,PostName,TotalVotesReceived,EStatus,Rank
2267,1,1,शुशीला नेम्‍वाङ्ग,महिला,60,नेपाल कम्युनिष्ट पार्टी (एकीकृत मार्क्सवादी-लेनिनवादी),इलाम,इलाम नगरपालिका,,उपप्रमुख,10946,E,1
2268,0,1,चन्दा के.सी(कार्की),महिला,55,नेपाली काँग्रेस,इलाम,इलाम नगरपालिका,,उपप्रमुख,9254,,2
2269,40,1,टंक बहादुर नोगु,पुरुष,40,संघीय लोकतान्त्रिक राष्ट्रिय मञ्च,इलाम,इलाम नगरपालिका,,उपप्रमुख,95,,6
2270,4,1,आइती कुमारी राई,महिला,50,"संघीय समाजवादी फोरम, नेपाल ",इलाम,इलाम नगरपालिका,,उपप्रमुख,170,,4
2271,3,1,माया देवी भण्डारी,महिला,37,राष्ट्रिय प्रजातन्त्र पार्टी ,इलाम,इलाम नगरपालिका,,उपप्रमुख,146,,5
2272,2,1,प्रेम कुमारी गुरुङ्ग,महिला,51,नेपाल कम्युनिष्ट पार्टी (माओवादी केन्द्र),इलाम,इलाम नगरपालिका,,उपप्रमुख,1048,,3
