Age,CandidateName,DistrictName,EStatus,Gender,LocalBodyName,PoliticalPartyName,PostName,Rank,Remarks,SerialNo,TotalVotesRecieved,UCStatus,WardNo
50,आङ छिरिङ शेर्पा,दोलखा,,पुरुष,विगु गाउँपालिका,नेपाल कम्युनिष्ट पार्टी (मार्क्सवादी–लेनिनवादी),अध्यक्ष,4,,835,29,N,
32,टहल बहादुर थामी,दोलखा,,पुरुष,विगु गाउँपालिका,"संघीय समाजवादी फोरम, नेपाल",अध्यक्ष,3,,836,50,N,
37,सुन्‍दर कुमार लामिछाने,दोलखा,,पुरुष,विगु गाउँपालिका,नेपाल कम्युनिष्ट पार्टी (एकीकृत मार्क्सवादी-लेनिनवादी),अध्यक्ष,2,,837,2586,N,
56,युधिष्‍टिर खड्का,दोलखा,E,पुरुष,विगु गाउँपालिका,नेपाली काँग्रेस,अध्यक्ष,1,Elected,838,4023,N,
43,कर्ण बहादुर थामी,दोलखा,,पुरुष,विगु गाउँपालिका,स्वतन्त्र,अध्यक्ष,5,,839,20,N,