SerialNo,PartyID,StateID,CandidateName,Gender,Age,PoliticalPartyName,DistrictName,LocalBodyName,WardNo,PostName,TotalVotesReceived,EStatus,Rank
24237,0,2,चन्द्रकला देवी सुडी,महिला,63,नेपाली काँग्रेस,सर्लाही,हरिपुर्वा नगरपालिका,,उपप्रमुख,2640,E,1
24238,81,2,राम दुलारी यादव,महिला,47,राष्ट्रिय जनता पार्टी नेपाल,सर्लाही,हरिपुर्वा नगरपालिका,,उपप्रमुख,2408,,2
24239,2,2,कोसिला देवी राय,महिला,44,नेपाल कम्युनिष्ट पार्टी (माओवादी केन्द्र),सर्लाही,हरिपुर्वा नगरपालिका,,उपप्रमुख,2179,,3
24240,80,2,मनोज कुमार राय,पुरुष,31,नेपाल लोकतान्त्रिक फोरम,सर्लाही,हरिपुर्वा नगरपालिका,,उपप्रमुख,50,,7
24241,4,2,सज्ञान देवी यादब,महिला,43,"संघीय समाजवादी फोरम, नेपाल ",सर्लाही,हरिपुर्वा नगरपालिका,,उपप्रमुख,956,,5
24242,82,2,जनीसा खातुन,महिला,48,राष्ट्रिय प्रजातन्त्र पार्टी  (प्रजातान्त्रिक),सर्लाही,हरिपुर्वा नगरपालिका,,उपप्रमुख,335,,6
24243,1,2,वन्दना कुमारी शाह,महिला,26,नेपाल कम्युनिष्ट पार्टी (एकीकृत मार्क्सवादी-लेनिनवादी),सर्लाही,हरिपुर्वा नगरपालिका,,उपप्रमुख,1225,,4
