PartyID,StateID,CandidateName,Gender,Age,PoliticalPartyName,DistrictName,LocalBodyName,WardNo,PostName,SerialNo,TotalVotesReceived,EStatus,Rank
0,2,सियाराम राय,पुरुष,68,नेपाली काँग्रेस,सर्लाही,हरिपुर्वा नगरपालिका,,प्रमुख,24228,3753,E,1
2,2,व्रजभुषण प्रसाद साह,पुरुष,48,नेपाल कम्युनिष्ट पार्टी (माओवादी केन्द्र),सर्लाही,हरिपुर्वा नगरपालिका,,प्रमुख,24229,2359,,2
81,2,विरेन्द्र यादव,पुरुष,39,राष्ट्रिय जनता पार्टी नेपाल,सर्लाही,हरिपुर्वा नगरपालिका,,प्रमुख,24230,2088,,3
1,2,जय पकाश यादव,पुरुष,51,नेपाल कम्युनिष्ट पार्टी (एकीकृत मार्क्सवादी-लेनिनवादी),सर्लाही,हरिपुर्वा नगरपालिका,,प्रमुख,24231,1059,,4
84,2,खेहरु राम,पुरुष,43,स्वतन्त्र,सर्लाही,हरिपुर्वा नगरपालिका,,प्रमुख,24232,2,,9
82,2,महेसर राय यादव,पुरुष,46,राष्ट्रिय प्रजातन्त्र पार्टी  (प्रजातान्त्रिक),सर्लाही,हरिपुर्वा नगरपालिका,,प्रमुख,24233,261,,6
84,2,चन्द्र भुष्ण दत्त कायस्त,पुरुष,59,स्वतन्त्र,सर्लाही,हरिपुर्वा नगरपालिका,,प्रमुख,24234,93,,7
84,2,नवल किशोर राय,पुरुष,39,स्वतन्त्र,सर्लाही,हरिपुर्वा नगरपालिका,,प्रमुख,24235,4,,8
4,2,रामभजन राय,पुरुष,52,"संघीय समाजवादी फोरम, नेपाल ",सर्लाही,हरिपुर्वा नगरपालिका,,प्रमुख,24236,440,,5
