PartyID,StateID,CandidateName,Gender,Age,PoliticalPartyName,DistrictName,LocalBodyName,WardNo,PostName,SerialNo,TotalVotesReceived,EStatus,Rank
0,2,भुनेश्‍वर धामी,पुरुष,62,नेपाली काँग्रेस,बारा,करैयामाई गाउँपालिका,,अध्यक्ष,29171,3329,E,1
4,2,शम्भु प्रसाद यादव,पुरुष,46,"संघीय समाजवादी फोरम, नेपाल ",बारा,करैयामाई गाउँपालिका,,अध्यक्ष,29172,3159,,2
10,2,हरि भोजन पासवान,पुरुष,26,नेपाल कम्युनिष्ट पार्टी (संयुक्त),बारा,करैयामाई गाउँपालिका,,अध्यक्ष,29173,21,,6
2,2,मिश्रीलाल सहनी मलाह,पुरुष,39,नेपाल कम्युनिष्ट पार्टी (माओवादी केन्द्र),बारा,करैयामाई गाउँपालिका,,अध्यक्ष,29174,932,,4
80,2,धिरेन्द्र चौधरी,पुरुष,35,नेपाल लोकतान्त्रिक फोरम,बारा,करैयामाई गाउँपालिका,,अध्यक्ष,29175,364,,5
1,2,मोतीलाल चौधरी,पुरुष,32,नेपाल कम्युनिष्ट पार्टी (एकीकृत मार्क्सवादी-लेनिनवादी),बारा,करैयामाई गाउँपालिका,,अध्यक्ष,29176,2094,,3
