PartyID,StateID,CandidateName,Gender,Age,PoliticalPartyName,DistrictName,LocalBodyName,WardNo,PostName,SerialNo,TotalVotesReceived,EStatus,Rank
0,2,गायत्री देवी,महिला,51,नेपाली काँग्रेस,पर्सा,बहुदरमाई नगरपालिका,,उपप्रमुख,35878,3818,E,1
81,2,सुनिता कुमारी शाह,महिला,42,राष्ट्रिय जनता पार्टी नेपाल,पर्सा,बहुदरमाई नगरपालिका,,उपप्रमुख,35879,3031,,2
1,2,सिता देवी साह,महिला,35,नेपाल कम्युनिष्ट पार्टी (एकीकृत मार्क्सवादी-लेनिनवादी),पर्सा,बहुदरमाई नगरपालिका,,उपप्रमुख,35880,2056,,3
9,2,सुनिता गुप्‍ता,महिला,32,राष्ट्रिय जनमोर्चा ,पर्सा,बहुदरमाई नगरपालिका,,उपप्रमुख,35881,19,,8
80,2,शान्ति देवी,महिला,41,नेपाल लोकतान्त्रिक फोरम,पर्सा,बहुदरमाई नगरपालिका,,उपप्रमुख,35882,767,,5
2,2,ज्ञान्ती देवी मलाहिन,महिला,49,नेपाल कम्युनिष्ट पार्टी (माओवादी केन्द्र),पर्सा,बहुदरमाई नगरपालिका,,उपप्रमुख,35883,558,,6
82,2,सिला देवी तेलीन,महिला,77,राष्ट्रिय प्रजातन्त्र पार्टी  (प्रजातान्त्रिक),पर्सा,बहुदरमाई नगरपालिका,,उपप्रमुख,35884,120,,7
4,2,सरोज देवी यादव,महिला,34,"संघीय समाजवादी फोरम, नेपाल ",पर्सा,बहुदरमाई नगरपालिका,,उपप्रमुख,35885,1523,,4
