SerialNo,StateID,CandidateName,Gender,Age,PoliticalPartyName,DistrictName,CenterConstID,SCConstID,TotalVotesReceived,EStatus,Rank
228,1,शिव नारायण गनगाई,पुरुष,60,नेपाली काँग्रेस,मोरङ्ग,2,1,16418,Elected,1
229,1,गणेश प्रसाद उप्रेती,पुरुष,39,नेपाल कम्युनिष्ट पार्टी (माओवादी केन्द्र),मोरङ्ग,2,1,15107,,2
230,1,अमरेन्द्र कुमार साह,पुरुष,35,राष्ट्रिय जनता पार्टी नेपाल,मोरङ्ग,2,1,2868,,3
231,1,उदय कुमार यादव,पुरुष,43,संघीय समाजवादी फोरम नेपाल,मोरङ्ग,2,1,2123,,4
232,1,धर्म दास पासवान,पुरुष,36,एकीकृत राष्ट्रिय प्रजातन्त्र पार्टी(राष्ट्रवादी),मोरङ्ग,2,1,318,,5
233,1,बल बहादुर लिम्बु,पुरुष,55,संघीय लोकतान्त्रिक राष्ट्रिय मञ्च,मोरङ्ग,2,1,290,,6
234,1,नारायण ताजपुरीया,पुरुष,39,नेपाल जनता पार्टी,मोरङ्ग,2,1,219,,7
235,1,दुर्गा नन्द तियर,पुरुष,49,देशभक्त जनगणतान्त्रिक मोर्चा नेपाल,मोरङ्ग,2,1,117,,8
