SerialNo,StateID,CandidateName,Gender,Age,PoliticalPartyName,DistrictName,CenterConstID,TotalVotesReceived,EStatus,Rank
173,1,शिव कुमार मंडल (केवट),पुरुष,42,नेपाल कम्युनिष्ट पार्टी (माओवादी केन्द्र),मोरङ्ग,5,22945,Elected,1
174,1,अमृत कुमार अर्याल,पुरुष,58,नेपाली काँग्रेस,मोरङ्ग,5,19153,,2
175,1,राज कुमार यादव,पुरुष,45,संघीय समाजवादी फोरम नेपाल,मोरङ्ग,5,18649,,3
176,1,बद्री प्रसाद मण्डल,पुरुष,74,राष्ट्रिय जनता पार्टी नेपाल,मोरङ्ग,5,1895,,4
177,1,कुर्वान मिंया,पुरुष,65,एकीकृत राष्ट्रिय प्रजातन्त्र पार्टी(राष्ट्रवादी),मोरङ्ग,5,667,,5
178,1,अमोद डमजन,पुरुष,53,देशभक्त जनगणतान्त्रिक मोर्चा नेपाल,मोरङ्ग,5,498,,6
179,1,अनिता कुमारी ढकाल,महिला,39,स्वतन्त्र,मोरङ्ग,5,122,,7
