SerialNo,PartyID,StateID,CandidateName,Gender,Age,PoliticalPartyName,DistrictName,LocalBodyName,WardNo,PostName,TotalVotesReceived,EStatus,Rank
22772,4,2,किशुन देब राय,पुरुष,45,"संघीय समाजवादी फोरम, नेपाल ",सर्लाही,पर्सा गाउँपालिका,,अध्यक्ष,2316,E,1
22773,81,2,दिनेश कुमार यादव,पुरुष,34,राष्ट्रिय जनता पार्टी नेपाल,सर्लाही,पर्सा गाउँपालिका,,अध्यक्ष,1840,,2
22774,0,2,रामसेवक राय,पुरुष,61,नेपाली काँग्रेस,सर्लाही,पर्सा गाउँपालिका,,अध्यक्ष,859,,3
22775,2,2,सुधीर कुमार झा ब्राम्हण,पुरुष,44,नेपाल कम्युनिष्ट पार्टी (माओवादी केन्द्र),सर्लाही,पर्सा गाउँपालिका,,अध्यक्ष,503,,4
22776,84,2,राज किशोर राय यादव,पुरुष,49,स्वतन्त्र,सर्लाही,पर्सा गाउँपालिका,,अध्यक्ष,436,,5
22777,84,2,रामधारी मण्डल,पुरुष,32,स्वतन्त्र,सर्लाही,पर्सा गाउँपालिका,,अध्यक्ष,0,,11
22778,82,2,रंजित कुमार राय,पुरुष,25,राष्ट्रिय प्रजातन्त्र पार्टी  (प्रजातान्त्रिक),सर्लाही,पर्सा गाउँपालिका,,अध्यक्ष,43,,7
22779,84,2,चन्द्रकान्त ठाकुर,पुरुष,31,स्वतन्त्र,सर्लाही,पर्सा गाउँपालिका,,अध्यक्ष,23,,8
22780,67,2,ज्ञानेन्द्र महतो,पुरुष,41,"नयाँ शक्ति पार्टी, नेपाल",सर्लाही,पर्सा गाउँपालिका,,अध्यक्ष,8,,9
22781,84,2,पंकज कुमार झा,पुरुष,31,स्वतन्त्र,सर्लाही,पर्सा गाउँपालिका,,अध्यक्ष,2,,10
22782,1,2,राजकिशोर राय यादव,पुरुष,60,नेपाल कम्युनिष्ट पार्टी (एकीकृत मार्क्सवादी-लेनिनवादी),सर्लाही,पर्सा गाउँपालिका,,अध्यक्ष,293,,6
