SerialNo,PartyID,StateID,CandidateName,Gender,Age,PoliticalPartyName,DistrictName,LocalBodyName,WardNo,PostName,TotalVotesReceived,EStatus,Rank
4138,3,1,अन्जरा आलम,पुरुष,49,राष्ट्रिय प्रजातन्त्र पार्टी ,झापा,कचनकवल गाउँपालिका,,अध्यक्ष,5816,E,1
4139,0,1,कालेन्द्र प्रसाद सिंह राजवंशी,पुरुष,50,नेपाली काँग्रेस,झापा,कचनकवल गाउँपालिका,,अध्यक्ष,5353,,2
4140,4,1,मन्जुरा राई,महिला,31,"संघीय समाजवादी फोरम, नेपाल ",झापा,कचनकवल गाउँपालिका,,अध्यक्ष,57,,5
4141,2,1,हंश नारायण राजबंशी,पुरुष,50,नेपाल कम्युनिष्ट पार्टी (माओवादी केन्द्र),झापा,कचनकवल गाउँपालिका,,अध्यक्ष,1250,,4
4142,1,1,शेर बहादुर खत्री,पुरुष,56,नेपाल कम्युनिष्ट पार्टी (एकीकृत मार्क्सवादी-लेनिनवादी),झापा,कचनकवल गाउँपालिका,,अध्यक्ष,3972,,3
