SerialNo,PartyID,StateID,CandidateName,Gender,Age,PoliticalPartyName,DistrictName,LocalBodyName,WardNo,PostName,TotalVotesReceived,EStatus,Rank
26881,2,2,कान्ती देवी,महिला,37,नेपाल कम्युनिष्ट पार्टी (माओवादी केन्द्र),रौतहट,फतुवा बिजयपुर नगरपालिका,,उपप्रमुख,3203,E,1
26882,0,2,अमवेया खातुन,महिला,40,नेपाली काँग्रेस,रौतहट,फतुवा बिजयपुर नगरपालिका,,उपप्रमुख,3127,,2
26883,81,2,कोशिला राउत जैसवार,महिला,40,राष्ट्रिय जनता पार्टी नेपाल,रौतहट,फतुवा बिजयपुर नगरपालिका,,उपप्रमुख,1604,,5
26884,4,2,चन्दा चौधरी,महिला,35,"संघीय समाजवादी फोरम, नेपाल ",रौतहट,फतुवा बिजयपुर नगरपालिका,,उपप्रमुख,1731,,4
26885,1,2,पवित्रा कार्की,महिला,42,नेपाल कम्युनिष्ट पार्टी (एकीकृत मार्क्सवादी-लेनिनवादी),रौतहट,फतुवा बिजयपुर नगरपालिका,,उपप्रमुख,2185,,3
