क्र.सं.,जिल्ला,स्थानीय तह,पद,वडा नं.,उम्मेदवारको नाम,लिङ्ग,उमेर,राजनीतिक दलको नाम,जम्मा प्राप्त मत,स्थान,कैफियत
12152,भक्तपुर,भक्तपुर नगरपालिका,उपप्रमुख,,रजनी जोशी,महिला,52,नेपाल मजदुर किसान पार्टी,25711,1,Elected
12153,भक्तपुर,भक्तपुर नगरपालिका,उपप्रमुख,,गंगा लक्ष्मी अवाल,महिला,45,नेपाली काँग्रेस,6587,2,
12154,भक्तपुर,भक्तपुर नगरपालिका,उपप्रमुख,,ललिता न्यौपाने,महिला,41,"नयाँ शक्ति पार्टी, नेपाल",117,6,
12155,भक्तपुर,भक्तपुर नगरपालिका,उपप्रमुख,,इन्द्र माया सुवाल,महिला,43,नेपाल कम्युनिष्ट पार्टी (माओवादी केन्द्र),2170,4,
12156,भक्तपुर,भक्तपुर नगरपालिका,उपप्रमुख,,अमिता बोहजू (गोसाई),महिला,27,राष्ट्रिय जनमोर्चा,540,5,
12157,भक्तपुर,भक्तपुर नगरपालिका,उपप्रमुख,,कृष्ण माया त्वायनाबासु (बोयजु),महिला,36,नेपाल कम्युनिष्ट पार्टी (एकीकृत मार्क्सवादी-लेनिनवादी),4631,3,