SerialNo,PartyID,StateID,CandidateName,Gender,Age,PoliticalPartyName,DistrictName,LocalBodyName,WardNo,PostName,TotalVotesReceived,EStatus,Rank
40763,0,6,मीन बहादुर बोगटी,पुरुष,46,नेपाली काँग्रेस,कालिकोट,नरहरिनाथ गाउँपालिका,,अध्यक्ष,2228,,2
40764,1,6,धिर बहादुर विष्‍ट,पुरुष,50,नेपाल कम्युनिष्ट पार्टी (एकीकृत मार्क्सवादी-लेनिनवादी),कालिकोट,नरहरिनाथ गाउँपालिका,,अध्यक्ष,2460,E,1
40765,2,6,अग्र बहादुर विष्‍ट,पुरुष,45,नेपाल कम्युनिष्ट पार्टी (माओवादी केन्द्र),कालिकोट,नरहरिनाथ गाउँपालिका,,अध्यक्ष,2137,,3
40766,3,6,रोजना देवि दर्जि,महिला,42,राष्ट्रिय प्रजातन्त्र पार्टी ,कालिकोट,नरहरिनाथ गाउँपालिका,,अध्यक्ष,102,,4
40767,12,6,जनक बहादुर बिष्‍ट,पुरुष,46,नेपाल मजदुर किसान पार्टी ,कालिकोट,नरहरिनाथ गाउँपालिका,,अध्यक्ष,59,,5
40768,67,6,दान बहादुर सहकारी,पुरुष,41,"नयाँ शक्ति पार्टी, नेपाल",कालिकोट,नरहरिनाथ गाउँपालिका,,अध्यक्ष,12,,6
40769,5,6,अर्जुन सहकारी,पुरुष,23,"मधेशी जनअधिकार फोरम, नेपाल (लोकतान्त्रिक)",कालिकोट,नरहरिनाथ गाउँपालिका,,अध्यक्ष,1,,7
