SerialNo,StateID,CandidateName,Gender,Age,PoliticalPartyName,DistrictName,CenterConstID,SCConstID,TotalVotesReceived,EStatus,Rank
202,1,इन्द्र मणी पराजुली,पुरुष,47,नेपाल कम्युनिष्ट पार्टी (एमाले),धनकुटा,1,2,20652,Elected,1
203,1,अर्जुन थापा,पुरुष,53,संघीय समाजवादी फोरम नेपाल,धनकुटा,1,2,8231,,2
204,1,दाजङबो शेर्पा,पुरुष,45,एकीकृत राष्ट्रिय प्रजातन्त्र पार्टी(राष्ट्रवादी),धनकुटा,1,2,1921,,3
205,1,बाल कुमार ताम्ली,पुरुष,29,संघीय लोकतान्त्रिक राष्ट्रिय मञ्च,धनकुटा,1,2,463,,4
206,1,विकाश तामाङ्ग,पुरुष,35,नेपाली कांग्रेस (बी.पी.),धनकुटा,1,2,113,,5
207,1,दुर्ग मान थापा,पुरुष,63,नेपाल मजदुर किसान पार्टी,धनकुटा,1,2,72,,6
