SerialNo,PartyID,StateID,CandidateName,Gender,Age,PoliticalPartyName,DistrictName,LocalBodyName,WardNo,PostName,TotalVotesReceived,EStatus,Rank
15121,1,3,राम देवी तामाङ,महिला,46,नेपाल कम्युनिष्ट पार्टी (एकीकृत मार्क्सवादी-लेनिनवादी),काभ्रेपलाञ्चोक,नमोबुद्ध नगरपालिका,,उपप्रमुख,5147,E,1
15122,0,3,कमला  खनाल ,महिला,47,नेपाली काँग्रेस,काभ्रेपलाञ्चोक,नमोबुद्ध नगरपालिका,,उपप्रमुख,4411,,2
15123,2,3,देवकी कोइराला (खनाल),महिला,46,नेपाल कम्युनिष्ट पार्टी (माओवादी केन्द्र),काभ्रेपलाञ्चोक,नमोबुद्ध नगरपालिका,,उपप्रमुख,3639,,3
15124,67,3,कुमार दाहाल ,पुरुष,43,"नयाँ शक्ति पार्टी, नेपाल",काभ्रेपलाञ्चोक,नमोबुद्ध नगरपालिका,,उपप्रमुख,499,,4
15125,5,3,ध्रुव लाल श्रेष्ठ,पुरुष,40,"मधेशी जनअधिकार फोरम, नेपाल (लोकतान्त्रिक)",काभ्रेपलाञ्चोक,नमोबुद्ध नगरपालिका,,उपप्रमुख,493,,5
15126,3,3,भवानी उप्रेती,महिला,59,राष्ट्रिय प्रजातन्त्र पार्टी ,काभ्रेपलाञ्चोक,नमोबुद्ध नगरपालिका,,उपप्रमुख,90,,6
