SerialNo,StateID,CandidateName,Gender,Age,PoliticalPartyName,DistrictName,CenterConstID,SCConstID,TotalVotesReceived,EStatus,Rank
271,1,जिवन घिमीरे,पुरुष,54,नेपाल कम्युनिष्ट पार्टी (एमाले),मोरङ्ग,4,2,13805,Elected,1
272,1,विश्‍वनाथ रिजाल,पुरुष,55,नेपाली काँग्रेस,मोरङ्ग,4,2,11625,,2
273,1,श्रीराम कामत,पुरुष,42,संघीय समाजवादी फोरम नेपाल,मोरङ्ग,4,2,3621,,3
274,1,राज कुमार कार्की,पुरुष,60,एकीकृत राष्ट्रिय प्रजातन्त्र पार्टी(राष्ट्रवादी),मोरङ्ग,4,2,413,,4
275,1,प्रवेश पाण्डे,पुरुष,37,देशभक्त जनगणतान्त्रिक मोर्चा नेपाल,मोरङ्ग,4,2,270,,5
276,1,संजय बिक्रम अधिकारी,पुरुष,54,नयाँ शक्ति पार्टी नेपाल,मोरङ्ग,4,2,105,,6
277,1,मो इश्‍लाम मिया,पुरुष,45,लोककल्याणकारी जनता पार्टी नेपाल,मोरङ्ग,4,2,80,,7
