PartyID,StateID,CandidateName,Gender,Age,PoliticalPartyName,DistrictName,LocalBodyName,WardNo,PostName,SerialNo,TotalVotesReceived,EStatus,Rank
2,2,नागीना देवी यादव,महिला,34,नेपाल कम्युनिष्ट पार्टी (माओवादी केन्द्र),महोत्तरी,साम्सी गाउँपालिका,,उपाध्यक्ष,16354,2234,E,1
0,2,सुनिता देवी,महिला,35,नेपाली काँग्रेस,महोत्तरी,साम्सी गाउँपालिका,,उपाध्यक्ष,16355,1609,,2
4,2,बुनी खातुन,महिला,67,"संघीय समाजवादी फोरम, नेपाल ",महोत्तरी,साम्सी गाउँपालिका,,उपाध्यक्ष,16356,1481,,3
81,2,कामिनी देवी झा,महिला,51,राष्ट्रिय जनता पार्टी नेपाल,महोत्तरी,साम्सी गाउँपालिका,,उपाध्यक्ष,16357,1431,,4
82,2,कलिमुदिन मोमिन,पुरुष,64,राष्ट्रिय प्रजातन्त्र पार्टी  (प्रजातान्त्रिक),महोत्तरी,साम्सी गाउँपालिका,,उपाध्यक्ष,16358,14,,9
16,2,फतमा खातुन,महिला,51,बहुजन शक्ति पार्टी ,महोत्तरी,साम्सी गाउँपालिका,,उपाध्यक्ष,16359,849,,6
67,2,राजदेब यादव,पुरुष,48,"नयाँ शक्ति पार्टी, नेपाल",महोत्तरी,साम्सी गाउँपालिका,,उपाध्यक्ष,16360,785,,7
84,2,काली यादव,पुरुष,73,स्वतन्त्र,महोत्तरी,साम्सी गाउँपालिका,,उपाध्यक्ष,16361,97,,8
1,2,शेष मोहम्‍मद ईदरिस,पुरुष,60,नेपाल कम्युनिष्ट पार्टी (एकीकृत मार्क्सवादी-लेनिनवादी),महोत्तरी,साम्सी गाउँपालिका,,उपाध्यक्ष,16362,1142,,5
