PartyID,StateID,CandidateName,Gender,Age,PoliticalPartyName,DistrictName,LocalBodyName,WardNo,PostName,SerialNo,TotalVotesReceived,EStatus,Rank
0,5,धनी कुमारी खत्री,महिला,63,नेपाली काँग्रेस,बाँके,राप्ती सोनारी गाउँपालिका,,उपाध्यक्ष,44197,8203,E,1
1,5,चमेली कुमारी बाकवल,महिला,30,नेपाल कम्युनिष्ट पार्टी (एकीकृत मार्क्सवादी-लेनिनवादी),बाँके,राप्ती सोनारी गाउँपालिका,,उपाध्यक्ष,44198,6924,,2
67,5,देउमा कुमारी पुन,महिला,31,"नयाँ शक्ति पार्टी, नेपाल",बाँके,राप्ती सोनारी गाउँपालिका,,उपाध्यक्ष,44199,241,,6
3,5,गुलशन चौधरी,महिला,25,राष्ट्रिय प्रजातन्त्र पार्टी ,बाँके,राप्ती सोनारी गाउँपालिका,,उपाध्यक्ष,44200,1634,,4
5,5,सुक कुमारी थारु,महिला,43,"मधेशी जनअधिकार फोरम, नेपाल (लोकतान्त्रिक)",बाँके,राप्ती सोनारी गाउँपालिका,,उपाध्यक्ष,44201,813,,5
2,5,आसमाली पुनमगर,महिला,33,नेपाल कम्युनिष्ट पार्टी (माओवादी केन्द्र),बाँके,राप्ती सोनारी गाउँपालिका,,उपाध्यक्ष,44202,6529,,3
