PartyID,StateID,CandidateName,Gender,Age,PoliticalPartyName,DistrictName,LocalBodyName,WardNo,PostName,SerialNo,TotalVotesReceived,EStatus,Rank
0,1,विमला राई,महिला,36,नेपाली काँग्रेस,खोटाङ्ग,हलेसी तुवाचुङ नगरपालिका,,उपप्रमुख,21995,4486,E,1
1,1,मनिषा राई,महिला,33,नेपाल कम्युनिष्ट पार्टी (एकीकृत मार्क्सवादी-लेनिनवादी),खोटाङ्ग,हलेसी तुवाचुङ नगरपालिका,,उपप्रमुख,21996,3922,,2
20,1,कविता राई,महिला,34,"खम्वुवान राष्ट्रिय मोर्चा, नेपाल ",खोटाङ्ग,हलेसी तुवाचुङ नगरपालिका,,उपप्रमुख,21997,37,,6
4,1,मनु राई,महिला,28,"संघीय समाजवादी फोरम, नेपाल ",खोटाङ्ग,हलेसी तुवाचुङ नगरपालिका,,उपप्रमुख,21998,285,,4
3,1,सुमित्रा घिमिरे,महिला,49,राष्ट्रिय प्रजातन्त्र पार्टी ,खोटाङ्ग,हलेसी तुवाचुङ नगरपालिका,,उपप्रमुख,21999,80,,5
2,1,कल्पना राई,महिला,27,नेपाल कम्युनिष्ट पार्टी (माओवादी केन्द्र),खोटाङ्ग,हलेसी तुवाचुङ नगरपालिका,,उपप्रमुख,22000,1632,,3
