SerialNo,StateID,CandidateName,Gender,Age,PoliticalPartyName,DistrictName,CenterConstID,SCConstID,TotalVotesReceived,EStatus,Rank
459,1,नारायण वहादुर मगर,पुरुष,53,स्वतन्त्र,उदयपुर,2,1,9870,Elected,1
460,1,भेष राज थापा मगर,पुरुष,42,नेपाली काँग्रेस,उदयपुर,2,1,5934,,2
461,1,विष्णु वहादुर वस्नेत,पुरुष,78,राष्ट्रिय प्रजातन्त्र पार्टी (प्रजातान्त्रिक),उदयपुर,2,1,765,,3
462,1,छिवाहाङ्ग राई,पुरुष,47,संघीय समाजवादी फोरम नेपाल,उदयपुर,2,1,293,,4
463,1,अरुण कुमार राई,पुरुष,35,नयाँ शक्ति पार्टी नेपाल,उदयपुर,2,1,90,,5
464,1,होम बहादुर दाहाल खत्री,पुरुष,54,स्वतन्त्र,उदयपुर,2,1,59,,6
