SerialNo,PartyID,StateID,CandidateName,Gender,Age,PoliticalPartyName,DistrictName,LocalBodyName,WardNo,PostName,TotalVotesReceived,EStatus,Rank
6561,2,2,फुल कुमारी श्रेष्‍ठ,महिला,50,नेपाल कम्युनिष्ट पार्टी (माओवादी केन्द्र),सिराहा,धनगढीमाई नगरपालिका,,उपप्रमुख,5613,E,1
6562,1,2,निर्मला देवी बास्तोला,महिला,43,नेपाल कम्युनिष्ट पार्टी (एकीकृत मार्क्सवादी-लेनिनवादी),सिराहा,धनगढीमाई नगरपालिका,,उपप्रमुख,4527,,2
6563,0,2,विमला देवी सुनार,महिला,55,नेपाली काँग्रेस,सिराहा,धनगढीमाई नगरपालिका,,उपप्रमुख,4275,,3
6564,72,2,श्‍याम कुमारी चौधरी,महिला,46,नेपाल पूर्वराष्ट्रसेवक लोकतान्त्रिक पार्टी,सिराहा,धनगढीमाई नगरपालिका,,उपप्रमुख,7,,8
6565,81,2,संगीता शर्मा,महिला,35,राष्ट्रिय जनता पार्टी नेपाल,सिराहा,धनगढीमाई नगरपालिका,,उपप्रमुख,193,,5
6566,3,2,पवन कुमार साह,पुरुष,28,राष्ट्रिय प्रजातन्त्र पार्टी ,सिराहा,धनगढीमाई नगरपालिका,,उपप्रमुख,64,,6
6567,16,2,सोमनी साहु,महिला,41,बहुजन शक्ति पार्टी ,सिराहा,धनगढीमाई नगरपालिका,,उपप्रमुख,8,,7
6568,4,2,गीता कुमारी यादव,महिला,32,"संघीय समाजवादी फोरम, नेपाल ",सिराहा,धनगढीमाई नगरपालिका,,उपप्रमुख,2370,,4
