PartyID,StateID,CandidateName,Gender,Age,PoliticalPartyName,DistrictName,LocalBodyName,WardNo,PostName,SerialNo,TotalVotesReceived,EStatus,Rank
1,2,रेणुका देवी काफ्‍ले,महिला,45,नेपाल कम्युनिष्ट पार्टी (एकीकृत मार्क्सवादी-लेनिनवादी),सर्लाही,हरिपुर नगरपालिका,,उपप्रमुख,24023,3858,E,1
0,2,पानबती देवी -,महिला,52,नेपाली काँग्रेस,सर्लाही,हरिपुर नगरपालिका,,उपप्रमुख,24024,3325,,2
16,2,सुनैना देवी तत्मा,महिला,34,बहुजन शक्ति पार्टी ,सर्लाही,हरिपुर नगरपालिका,,उपप्रमुख,24025,76,,6
81,2,लिलम कुमारी -,महिला,26,राष्ट्रिय जनता पार्टी नेपाल,सर्लाही,हरिपुर नगरपालिका,,उपप्रमुख,24026,1989,,4
4,2,राम भगत साह रौनियार,पुरुष,57,"संघीय समाजवादी फोरम, नेपाल ",सर्लाही,हरिपुर नगरपालिका,,उपप्रमुख,24027,206,,5
2,2,ईसर कुमारी दनुवार,महिला,52,नेपाल कम्युनिष्ट पार्टी (माओवादी केन्द्र),सर्लाही,हरिपुर नगरपालिका,,उपप्रमुख,24028,2893,,3
