PartyID,StateID,CandidateName,Gender,Age,PoliticalPartyName,DistrictName,LocalBodyName,WardNo,PostName,SerialNo,TotalVotesReceived,EStatus,Rank
2,6,झुप बहादुर बुढा मगर,पुरुष,40,नेपाल कम्युनिष्ट पार्टी (माओवादी केन्द्र),सुर्खेत,सिम्ता गाउँपालिका,,अध्यक्ष,47413,664,,3
0,6,खड्‍ग बहादुर पोखरेल,पुरुष,54,नेपाली काँग्रेस,सुर्खेत,सिम्ता गाउँपालिका,,अध्यक्ष,47414,4604,,2
3,6,खेम बहादुर सिंह,पुरुष,47,राष्ट्रिय प्रजातन्त्र पार्टी ,सुर्खेत,सिम्ता गाउँपालिका,,अध्यक्ष,47415,19,,4
67,6,सम्मर बहादुर सुनार,पुरुष,21,"नयाँ शक्ति पार्टी, नेपाल",सुर्खेत,सिम्ता गाउँपालिका,,अध्यक्ष,47416,12,,5
1,6,कविन्द्र कुमार के.सी,पुरुष,46,नेपाल कम्युनिष्ट पार्टी (एकीकृत मार्क्सवादी-लेनिनवादी),सुर्खेत,सिम्ता गाउँपालिका,,अध्यक्ष,47417,5355,E,1
