PartyID,StateID,CandidateName,Gender,Age,PoliticalPartyName,DistrictName,LocalBodyName,WardNo,PostName,SerialNo,TotalVotesReceived,EStatus,Rank
1,4,बेद बहादुर गुरुङ्ग,पुरुष,47,नेपाल कम्युनिष्ट पार्टी (एकीकृत मार्क्सवादी-लेनिनवादी),कास्की,मादी गाउँपालिका,,अध्यक्ष,27962,4637,E,1
0,4,देवी जङ्ग गुरुङ्ग,पुरुष,41,नेपाली काँग्रेस,कास्की,मादी गाउँपालिका,,अध्यक्ष,27963,3653,,2
2,4,राधा सापकोटा,महिला,46,नेपाल कम्युनिष्ट पार्टी (माओवादी केन्द्र),कास्की,मादी गाउँपालिका,,अध्यक्ष,27964,676,,3
4,4,राम काजी चर्माकार,पुरुष,40,"संघीय समाजवादी फोरम, नेपाल ",कास्की,मादी गाउँपालिका,,अध्यक्ष,27965,4,,4
15,4,नन्द कली भण्डारी,महिला,44,नेपाल परिवार दल ,कास्की,मादी गाउँपालिका,,अध्यक्ष,27966,1,,5
