SerialNo,StateID,CandidateName,Gender,Age,PoliticalPartyName,DistrictName,CenterConstID,SCConstID,TotalVotesReceived,EStatus,Rank
2687,5,कुल प्रसाद के.सी,पुरुष,46,नेपाल कम्युनिष्ट पार्टी (माओवादी केन्द्र),रोल्पा,1,1,18512,Elected,1
2688,5,शेर बहादुर महरा,पुरुष,48,नेपाली काँग्रेस,रोल्पा,1,1,10401,,2
2689,5,वीर सिंह ठकुरी,पुरुष,51,राष्ट्रिय प्रजातन्त्र पार्टी (प्रजातान्त्रिक),रोल्पा,1,1,728,,3
2690,5,दल विर पुन,पुरुष,54,एकीकृत राष्ट्रिय प्रजातन्त्र पार्टी(राष्ट्रवादी),रोल्पा,1,1,527,,4
2691,5,बुद्धी बहादुर राउत,पुरुष,47,राष्ट्रिय जनमोर्चा,रोल्पा,1,1,400,,5
2692,5,लालमन घर्तीमगर,पुरुष,30,मंगोल नेशनल अर्गनाइजेसन,रोल्पा,1,1,238,,6
2693,5,टिकामन वुढामगर,पुरुष,36,देशभक्त जनगणतान्त्रिक मोर्चा नेपाल,रोल्पा,1,1,142,,7
2694,5,खत घर्तिमगर,पुरुष,34,संघीय समाजवादी फोरम नेपाल,रोल्पा,1,1,100,,8
