PartyID,StateID,CandidateName,Gender,Age,PoliticalPartyName,DistrictName,LocalBodyName,WardNo,PostName,SerialNo,TotalVotesReceived,EStatus,Rank
1,1,हरि प्रसाद चोङवाङ लिम्बू,पुरुष,56,नेपाल कम्युनिष्ट पार्टी (एकीकृत मार्क्सवादी-लेनिनवादी),तेर्हथुम,फेदाप  गाउँपालिका,,अध्यक्ष,8805,3439,E,1
0,1,केशव प्रसाद भेटवाल,पुरुष,50,नेपाली काँग्रेस,तेर्हथुम,फेदाप  गाउँपालिका,,अध्यक्ष,8806,3220,,2
84,1,टंक प्रसाद भट्टराई,पुरुष,55,स्वतन्त्र,तेर्हथुम,फेदाप  गाउँपालिका,,अध्यक्ष,8807,2,,5
67,1,होम प्रसाद ढकाल,पुरुष,30,"नयाँ शक्ति पार्टी, नेपाल",तेर्हथुम,फेदाप  गाउँपालिका,,अध्यक्ष,8808,68,,4
40,1,तिल विक्रम लिम्बु,पुरुष,40,संघीय लोकतान्त्रिक राष्ट्रिय मञ्च,तेर्हथुम,फेदाप  गाउँपालिका,,अध्यक्ष,8809,115,,3
