PartyID,StateID,CandidateName,Gender,Age,PoliticalPartyName,DistrictName,LocalBodyName,WardNo,PostName,SerialNo,TotalVotesReceived,EStatus,Rank
1,1,सूर्य प्रसाद पोख्रेल,पुरुष,53,नेपाल कम्युनिष्ट पार्टी (एकीकृत मार्क्सवादी-लेनिनवादी),इलाम,देउमाई नगरपालिका,,प्रमुख,2644,7347,E,1
0,1,होम प्रसाद दुलाल,पुरुष,49,नेपाली काँग्रेस,इलाम,देउमाई नगरपालिका,,प्रमुख,2645,6645,,2
84,1,सूर्य बहादुर तामाङ्ग,पुरुष,60,स्वतन्त्र,इलाम,देउमाई नगरपालिका,,प्रमुख,2646,70,,6
4,1,दीर्ध राज रैका मगर,पुरुष,31,"संघीय समाजवादी फोरम, नेपाल ",इलाम,देउमाई नगरपालिका,,प्रमुख,2647,152,,4
40,1,हेम राज लिम्वु,पुरुष,30,संघीय लोकतान्त्रिक राष्ट्रिय मञ्च,इलाम,देउमाई नगरपालिका,,प्रमुख,2648,124,,5
2,1,राम कुमार राई,पुरुष,37,नेपाल कम्युनिष्ट पार्टी (माओवादी केन्द्र),इलाम,देउमाई नगरपालिका,,प्रमुख,2649,976,,3
