SerialNo,StateID,CandidateName,Gender,Age,PoliticalPartyName,DistrictName,CenterConstID,TotalVotesReceived,EStatus,Rank
1606,4,देवेन्द्र पौडेल,पुरुष,52,नेपाल कम्युनिष्ट पार्टी (माओवादी केन्द्र),बागलुङ,2,28827,Elected,1
1607,4,नर बहादुर पुन,पुरुष,58,नेपाली काँग्रेस,बागलुङ,2,19905,,2
1608,4,निल बहादुर पुन,पुरुष,64,देशभक्त जनगणतान्त्रिक मोर्चा नेपाल,बागलुङ,2,586,,3
1609,4,बाबुराम पाण्डे,पुरुष,41,आमूल परिवर्तन मसिहा पार्टी नेपाल,बागलुङ,2,262,,4
1610,4,याम बहादुर घर्तीमगर,पुरुष,40,संघीय समाजवादी फोरम नेपाल,बागलुङ,2,180,,5
