SerialNo,StateID,CandidateName,Gender,Age,PoliticalPartyName,DistrictName,CenterConstID,SCConstID,TotalVotesReceived,EStatus,Rank
1589,3,बसुन्धरा हुमागाई,पुरुष,46,नेपाल कम्युनिष्ट पार्टी (एमाले),काभ्रेपलाञ्चोक,2,2,28677,Elected,1
1590,3,कन्चन चन्द्र वादे,पुरुष,50,नेपाली काँग्रेस,काभ्रेपलाञ्चोक,2,2,21780,,2
1591,3,हरि प्रसाद मानन्धर,पुरुष,56,नेपाल मजदुर किसान पार्टी,काभ्रेपलाञ्चोक,2,2,631,,3
1592,3,विजय कुमार तामाङ,पुरुष,32,विवेकशील साझा पार्टी,काभ्रेपलाञ्चोक,2,2,545,,4
1593,3,राम चन्द्र श्रेष्‍ठ,पुरुष,59,नेपाल कम्युनिष्ट पार्टी (माले) ,काभ्रेपलाञ्चोक,2,2,452,,5
1594,3,पवन राज कर्णजीत,पुरुष,43,नयाँ शक्ति पार्टी नेपाल,काभ्रेपलाञ्चोक,2,2,189,,6
1595,3,सबर कुमार प्रजापती,पुरुष,38,राष्ट्रिय जनता पार्टी नेपाल,काभ्रेपलाञ्चोक,2,2,129,,7
1596,3,राजेन्द्र खड्गी,पुरुष,36,संघीय समाजवादी फोरम नेपाल,काभ्रेपलाञ्चोक,2,2,85,,8
