SerialNo,PartyID,StateID,CandidateName,Gender,Age,PoliticalPartyName,DistrictName,LocalBodyName,WardNo,PostName,TotalVotesReceived,EStatus,Rank
36895,2,5,कुमारी वराल(गौतम),महिला,34,नेपाल कम्युनिष्ट पार्टी (माओवादी केन्द्र),रुकुम पूर्व,सिस्ने गाउँपालिका,,अध्यक्ष,3296,E,1
36896,1,5,नन्द लाल शर्मा,पुरुष,65,नेपाल कम्युनिष्ट पार्टी (एकीकृत मार्क्सवादी-लेनिनवादी),रुकुम पूर्व,सिस्ने गाउँपालिका,,अध्यक्ष,2471,,2
36897,8,5,ठान बहादुर खडका,पुरुष,35,नेपाल कम्युनिष्ट पार्टी (मार्क्सवादी–लेनिनवादी),रुकुम पूर्व,सिस्ने गाउँपालिका,,अध्यक्ष,46,,3
36898,12,5,कालो खड्का,पुरुष,40,नेपाल मजदुर किसान पार्टी ,रुकुम पूर्व,सिस्ने गाउँपालिका,,अध्यक्ष,4,,7
36899,3,5,सुधीर विक्रम शाही,पुरुष,28,राष्ट्रिय प्रजातन्त्र पार्टी ,रुकुम पूर्व,सिस्ने गाउँपालिका,,अध्यक्ष,32,,5
36900,9,5,चन्द्र प्रसाद शाही,पुरुष,40,राष्ट्रिय जनमोर्चा ,रुकुम पूर्व,सिस्ने गाउँपालिका,,अध्यक्ष,9,,6
36901,67,5,उपेन्द्रलाल कामी,पुरुष,38,"नयाँ शक्ति पार्टी, नेपाल",रुकुम पूर्व,सिस्ने गाउँपालिका,,अध्यक्ष,41,,4
