SerialNo,PartyID,StateID,CandidateName,Gender,Age,PoliticalPartyName,DistrictName,LocalBodyName,WardNo,PostName,TotalVotesReceived,EStatus,Rank
43339,1,6,भावना भण्डारी,महिला,39,नेपाल कम्युनिष्ट पार्टी (एकीकृत मार्क्सवादी-लेनिनवादी),जाजरकोट,भेरी नगरपालिका,,उपप्रमुख,4162,E,1
43340,2,6,कृष्णा शर्मा,महिला,36,नेपाल कम्युनिष्ट पार्टी (माओवादी केन्द्र),जाजरकोट,भेरी नगरपालिका,,उपप्रमुख,3504,,2
43341,4,6,पदमा वती पुन,महिला,58,"संघीय समाजवादी फोरम, नेपाल ",जाजरकोट,भेरी नगरपालिका,,उपप्रमुख,41,,5
43342,3,6,लक्ष्मी खडका,महिला,33,राष्ट्रिय प्रजातन्त्र पार्टी ,जाजरकोट,भेरी नगरपालिका,,उपप्रमुख,143,,4
43343,0,6,धन कुमारी चपाई,महिला,33,नेपाली काँग्रेस,जाजरकोट,भेरी नगरपालिका,,उपप्रमुख,3483,,3
