PartyID,StateID,CandidateName,Gender,Age,PoliticalPartyName,DistrictName,LocalBodyName,WardNo,PostName,SerialNo,TotalVotesReceived,EStatus,Rank
2,6,दन्ता नेपाली,महिला,25,नेपाल कम्युनिष्ट पार्टी (माओवादी केन्द्र),कालिकोट,तिलागुफा नगरपालिका,,उपप्रमुख,40515,1843,E,1
0,6,लक्ष्मी शाही,महिला,48,नेपाली काँग्रेस,कालिकोट,तिलागुफा नगरपालिका,,उपप्रमुख,40516,1260,,2
67,6,जयकन्या पाण्डे,महिला,25,"नयाँ शक्ति पार्टी, नेपाल",कालिकोट,तिलागुफा नगरपालिका,,उपप्रमुख,40517,17,,6
1,6,गंगा देवि खत्री,महिला,54,नेपाल कम्युनिष्ट पार्टी (एकीकृत मार्क्सवादी-लेनिनवादी),कालिकोट,तिलागुफा नगरपालिका,,उपप्रमुख,40518,248,,4
17,6,शोभा शाही,महिला,40,अखण्ड नेपाल पार्टी,कालिकोट,तिलागुफा नगरपालिका,,उपप्रमुख,40519,29,,5
12,6,ऐन बहादुर शाही,पुरुष,58,नेपाल मजदुर किसान पार्टी ,कालिकोट,तिलागुफा नगरपालिका,,उपप्रमुख,40520,1216,,3
