SerialNo,PartyID,StateID,CandidateName,Gender,Age,PoliticalPartyName,DistrictName,LocalBodyName,WardNo,PostName,TotalVotesReceived,EStatus,Rank
40515,2,6,दन्ता नेपाली,महिला,25,नेपाल कम्युनिष्ट पार्टी (माओवादी केन्द्र),कालिकोट,तिलागुफा नगरपालिका,,उपप्रमुख,1843,E,1
40516,0,6,लक्ष्मी शाही,महिला,48,नेपाली काँग्रेस,कालिकोट,तिलागुफा नगरपालिका,,उपप्रमुख,1260,,2
40517,67,6,जयकन्या पाण्डे,महिला,25,"नयाँ शक्ति पार्टी, नेपाल",कालिकोट,तिलागुफा नगरपालिका,,उपप्रमुख,17,,6
40518,1,6,गंगा देवि खत्री,महिला,54,नेपाल कम्युनिष्ट पार्टी (एकीकृत मार्क्सवादी-लेनिनवादी),कालिकोट,तिलागुफा नगरपालिका,,उपप्रमुख,248,,4
40519,17,6,शोभा शाही,महिला,40,अखण्ड नेपाल पार्टी,कालिकोट,तिलागुफा नगरपालिका,,उपप्रमुख,29,,5
40520,12,6,ऐन बहादुर शाही,पुरुष,58,नेपाल मजदुर किसान पार्टी ,कालिकोट,तिलागुफा नगरपालिका,,उपप्रमुख,1216,,3
