SerialNo,StateID,CandidateName,Gender,Age,PoliticalPartyName,DistrictName,CenterConstID,TotalVotesReceived,EStatus,Rank
115,1,सुदन किराती,पुरुष,38,नेपाल कम्युनिष्ट पार्टी (माओवादी केन्द्र),भोजपुर,1,34394,Elected,1
116,1,उमेश जंग रायमाझी,पुरुष,48,नेपाली काँग्रेस,भोजपुर,1,21696,,2
117,1,अनिल बस्नेत,पुरुष,34,नेपाल कम्युनिष्ट पार्टी (माले) ,भोजपुर,1,2601,,3
118,1,डिल्ली राम वोहरा,पुरुष,38,देशभक्त जनगणतान्त्रिक मोर्चा नेपाल,भोजपुर,1,480,,4
119,1,चन्द्र प्रसाद राई,पुरुष,39,मंगोल नेशनल अर्गनाइजेसन,भोजपुर,1,480,,5
120,1,युवराज कटवाल,पुरुष,26,नयाँ शक्ति पार्टी नेपाल,भोजपुर,1,335,,6
121,1,ध्रुवराज राई,पुरुष,36,राष्ट्रिय जनता पार्टी नेपाल,भोजपुर,1,303,,7
122,1,केदार राई मेवाहाङ,पुरुष,28,संघीय लोकतान्त्रिक राष्ट्रिय मञ्च,भोजपुर,1,135,,8
