SerialNo,PartyID,StateID,CandidateName,Gender,Age,PoliticalPartyName,DistrictName,LocalBodyName,WardNo,PostName,TotalVotesReceived,EStatus,Rank
32913,0,4,लक्ष्‍मी देवी पाण्‍डे,महिला,48,नेपाली काँग्रेस,नवलपरासी (बर्दघाट सुस्ता पूर्व),हुप्सेकोट गाउँपालिका,,अध्यक्ष,4592,E,1
32914,1,4,मेक बहादुर पुलामी मगर,पुरुष,55,नेपाल कम्युनिष्ट पार्टी (एकीकृत मार्क्सवादी-लेनिनवादी),नवलपरासी (बर्दघाट सुस्ता पूर्व),हुप्सेकोट गाउँपालिका,,अध्यक्ष,4358,,2
32915,84,4,प्रितम सिंह फाल मगर,पुरुष,53,स्वतन्त्र,नवलपरासी (बर्दघाट सुस्ता पूर्व),हुप्सेकोट गाउँपालिका,,अध्यक्ष,13,,5
32916,3,4,याम बहादुर गाहा मगर,पुरुष,38,राष्ट्रिय प्रजातन्त्र पार्टी ,नवलपरासी (बर्दघाट सुस्ता पूर्व),हुप्सेकोट गाउँपालिका,,अध्यक्ष,76,,4
32917,2,4,चन्‍द्र बहादुर थापा,पुरुष,34,नेपाल कम्युनिष्ट पार्टी (माओवादी केन्द्र),नवलपरासी (बर्दघाट सुस्ता पूर्व),हुप्सेकोट गाउँपालिका,,अध्यक्ष,603,,3
