Age,CandidateName,DistrictName,EStatus,Gender,LocalBodyName,PoliticalPartyName,PostName,Rank,Remarks,SerialNo,TotalVotesRecieved,UCStatus,WardNo
60,कल्पना भण्डारी,दोलखा,E,महिला,मेलुङ गाउँपालिका,नेपाल कम्युनिष्ट पार्टी (एकीकृत मार्क्सवादी-लेनिनवादी),उपाध्यक्ष,1,Elected,719,4497,N,
60,कृष्ण बहादुर कार्की,दोलखा,,पुरुष,मेलुङ गाउँपालिका,नेपाल कम्युनिष्ट पार्टी (माओवादी केन्द्र),उपाध्यक्ष,2,,720,3232,N,
28,सज्‍जन थोकर तमाङ,दोलखा,,पुरुष,मेलुङ गाउँपालिका,स्वतन्त्र,उपाध्यक्ष,5,,721,0,N,
31,आसिता गोले,दोलखा,,महिला,मेलुङ गाउँपालिका,राष्ट्रिय प्रजातन्त्र पार्टी,उपाध्यक्ष,4,,722,65,N,
34,गीता भण्डारी,दोलखा,,महिला,मेलुङ गाउँपालिका,"नयाँ शक्ति पार्टी, नेपाल",उपाध्यक्ष,3,,723,135,N,