SerialNo,StateID,CandidateName,Gender,Age,PoliticalPartyName,DistrictName,CenterConstID,SCConstID,TotalVotesReceived,EStatus,Rank
73,1,गोपालचन्द्र बुढाथोकी,पुरुष,55,नेपाल कम्युनिष्ट पार्टी (एमाले),झापा,1,2,17839,Elected,1
74,1,अशोक कुमार पोखरेल,पुरुष,53,नेपाली काँग्रेस,झापा,1,2,9978,,2
75,1,लक्ष्मी प्रसाद मावो,पुरुष,42,संघीय लोकतान्त्रिक राष्ट्रिय मञ्च,झापा,1,2,842,,3
76,1,रामसुफल कामती,पुरुष,58,संघीय समाजवादी फोरम नेपाल,झापा,1,2,407,,4
77,1,श्री प्रसाद लिम्बु,पुरुष,65,मंगोल नेशनल अर्गनाइजेसन,झापा,1,2,199,,5
78,1,रमा मेचे,महिला,49,राष्ट्रिय जनता पार्टी नेपाल,झापा,1,2,123,,6
79,1,पर्शुराम काफ्ले,पुरुष,34,नयाँ शक्ति पार्टी नेपाल,झापा,1,2,121,,7
80,1,ख्याम बहादुर सुव्वा,पुरुष,38,राष्ट्रिय जनमुक्ति पार्टी,झापा,1,2,99,,8
