SerialNo,PartyID,StateID,CandidateName,Gender,Age,PoliticalPartyName,DistrictName,LocalBodyName,WardNo,PostName,TotalVotesReceived,EStatus,Rank
60144,1,7,शुशिला सिंह,महिला,41,नेपाल कम्युनिष्ट पार्टी (एकीकृत मार्क्सवादी-लेनिनवादी),कन्चनपुर,वेदकोट नगरपालिका,,उपप्रमुख,6865,E,1
60145,0,7,श्रीमती तुलसी देवी जोशी,महिला,35,नेपाली काँग्रेस,कन्चनपुर,वेदकोट नगरपालिका,,उपप्रमुख,5545,,2
60146,2,7,शान्ती कुमारी शाही (भण्‍डारी),महिला,34,नेपाल कम्युनिष्ट पार्टी (माओवादी केन्द्र),कन्चनपुर,वेदकोट नगरपालिका,,उपप्रमुख,3391,,3
60147,3,7,रम्‍भा देवी साउद,महिला,39,राष्ट्रिय प्रजातन्त्र पार्टी ,कन्चनपुर,वेदकोट नगरपालिका,,उपप्रमुख,744,,4
60148,10,7,मिना भट्ट,महिला,35,नेपाल कम्युनिष्ट पार्टी (संयुक्त),कन्चनपुर,वेदकोट नगरपालिका,,उपप्रमुख,35,,9
60149,9,7,देवकी पन्त,महिला,43,राष्ट्रिय जनमोर्चा ,कन्चनपुर,वेदकोट नगरपालिका,,उपप्रमुख,139,,6
60150,67,7,मञ्जु डगौरा,महिला,40,"नयाँ शक्ति पार्टी, नेपाल",कन्चनपुर,वेदकोट नगरपालिका,,उपप्रमुख,87,,7
60151,5,7,मनु डगौरा,महिला,29,"मधेशी जनअधिकार फोरम, नेपाल (लोकतान्त्रिक)",कन्चनपुर,वेदकोट नगरपालिका,,उपप्रमुख,80,,8
60152,8,7,ललिता के.सी.,महिला,35,नेपाल कम्युनिष्ट पार्टी (मार्क्सवादी–लेनिनवादी),कन्चनपुर,वेदकोट नगरपालिका,,उपप्रमुख,141,,5
