PartyID,StateID,CandidateName,Gender,Age,PoliticalPartyName,DistrictName,LocalBodyName,WardNo,PostName,SerialNo,TotalVotesReceived,EStatus,Rank
1,1,सरस्वती राई,महिला,36,नेपाल कम्युनिष्ट पार्टी (एकीकृत मार्क्सवादी-लेनिनवादी),इलाम,फाकफोकथुम गाउँपालिका,,उपाध्यक्ष,2818,4241,E,1
0,1,डाला कुमारी कार्की विष्‍ट,महिला,44,नेपाली काँग्रेस,इलाम,फाकफोकथुम गाउँपालिका,,उपाध्यक्ष,2819,3983,,2
3,1,टंक माया चौहान,महिला,29,राष्ट्रिय प्रजातन्त्र पार्टी ,इलाम,फाकफोकथुम गाउँपालिका,,उपाध्यक्ष,2820,61,,6
4,1,मैया चौहान,महिला,49,"संघीय समाजवादी फोरम, नेपाल ",इलाम,फाकफोकथुम गाउँपालिका,,उपाध्यक्ष,2821,172,,4
84,1,मनु लिम्ब‍ु,महिला,24,स्वतन्त्र,इलाम,फाकफोकथुम गाउँपालिका,,उपाध्यक्ष,2822,146,,5
2,1,लक्ष्मी लावती (मुखिया),महिला,26,नेपाल कम्युनिष्ट पार्टी (माओवादी केन्द्र),इलाम,फाकफोकथुम गाउँपालिका,,उपाध्यक्ष,2823,685,,3
