PartyID,StateID,CandidateName,Gender,Age,PoliticalPartyName,DistrictName,LocalBodyName,WardNo,PostName,SerialNo,TotalVotesReceived,EStatus,Rank
0,4,दिपक बाबु कँडेल,पुरुष,44,नेपाली काँग्रेस,गोरखा,पालुङटार नगरपालिका,,प्रमुख,24585,4698,E,1
2,4,विवस चिन्तन,पुरुष,40,नेपाल कम्युनिष्ट पार्टी (माओवादी केन्द्र),गोरखा,पालुङटार नगरपालिका,,प्रमुख,24586,4491,,2
84,4,रमेश रोका क्षेत्री,पुरुष,30,स्वतन्त्र,गोरखा,पालुङटार नगरपालिका,,प्रमुख,24587,57,,5
1,4,जुद्ध विलास भण्डारी,पुरुष,51,नेपाल कम्युनिष्ट पार्टी (एकीकृत मार्क्सवादी-लेनिनवादी),गोरखा,पालुङटार नगरपालिका,,प्रमुख,24588,2410,,4
67,4,अशोक देवकोटा,पुरुष,32,"नयाँ शक्ति पार्टी, नेपाल",गोरखा,पालुङटार नगरपालिका,,प्रमुख,24589,3976,,3
