SerialNo,PartyID,StateID,CandidateName,Gender,Age,PoliticalPartyName,DistrictName,LocalBodyName,WardNo,PostName,TotalVotesReceived,EStatus,Rank
24585,0,4,दिपक बाबु कँडेल,पुरुष,44,नेपाली काँग्रेस,गोरखा,पालुङटार नगरपालिका,,प्रमुख,4698,E,1
24586,2,4,विवस चिन्तन,पुरुष,40,नेपाल कम्युनिष्ट पार्टी (माओवादी केन्द्र),गोरखा,पालुङटार नगरपालिका,,प्रमुख,4491,,2
24587,84,4,रमेश रोका क्षेत्री,पुरुष,30,स्वतन्त्र,गोरखा,पालुङटार नगरपालिका,,प्रमुख,57,,5
24588,1,4,जुद्ध विलास भण्डारी,पुरुष,51,नेपाल कम्युनिष्ट पार्टी (एकीकृत मार्क्सवादी-लेनिनवादी),गोरखा,पालुङटार नगरपालिका,,प्रमुख,2410,,4
24589,67,4,अशोक देवकोटा,पुरुष,32,"नयाँ शक्ति पार्टी, नेपाल",गोरखा,पालुङटार नगरपालिका,,प्रमुख,3976,,3
