SerialNo,StateID,CandidateName,Gender,Age,PoliticalPartyName,DistrictName,CenterConstID,SCConstID,TotalVotesReceived,EStatus,Rank
436,1,मोहन कुमार खड्का,पुरुष,51,नेपाल कम्युनिष्ट पार्टी (माओवादी केन्द्र),ओखलढुंगा,1,2,15485,Elected,1
437,1,प्रदिप कुमार सुनुवार,पुरुष,47,नेपाली काँग्रेस,ओखलढुंगा,1,2,13711,,2
438,1,ज्ञानेन्द्र रुम्दाली,पुरुष,35,स्वतन्त्र,ओखलढुंगा,1,2,1858,,3
439,1,दिनेश  कुमार  राई,पुरुष,44,संघीय समाजवादी फोरम नेपाल,ओखलढुंगा,1,2,333,,4
440,1,टंक नाथ अधिकारी,पुरुष,52,नयाँ शक्ति पार्टी नेपाल,ओखलढुंगा,1,2,165,,5
441,1,विष्णु खड्का,पुरुष,27,देशभक्त जनगणतान्त्रिक मोर्चा नेपाल,ओखलढुंगा,1,2,111,,6
