PartyID,StateID,CandidateName,Gender,Age,PoliticalPartyName,DistrictName,LocalBodyName,WardNo,PostName,SerialNo,TotalVotesReceived,EStatus,Rank
0,1,हरि लाल सिंह,पुरुष,68,नेपाली काँग्रेस,मोरङ्ग,धनपालथान गाउँपालिका,,अध्यक्ष,13079,5187,E,1
1,1,मुसहरु मण्डल,पुरुष,66,नेपाल कम्युनिष्ट पार्टी (एकीकृत मार्क्सवादी-लेनिनवादी),मोरङ्ग,धनपालथान गाउँपालिका,,अध्यक्ष,13080,4835,,2
2,1,विकम पासवान,पुरुष,50,नेपाल कम्युनिष्ट पार्टी (माओवादी केन्द्र),मोरङ्ग,धनपालथान गाउँपालिका,,अध्यक्ष,13081,3289,,3
84,1,श्रीमन्नारायण विष्‍ट,पुरुष,44,स्वतन्त्र,मोरङ्ग,धनपालथान गाउँपालिका,,अध्यक्ष,13082,2,,8
5,1,रामा सहनी,पुरुष,57,"मधेशी जनअधिकार फोरम, नेपाल (लोकतान्त्रिक)",मोरङ्ग,धनपालथान गाउँपालिका,,अध्यक्ष,13083,420,,5
3,1,खजुर लाल राजबंशी,पुरुष,62,राष्ट्रिय प्रजातन्त्र पार्टी ,मोरङ्ग,धनपालथान गाउँपालिका,,अध्यक्ष,13084,61,,6
84,1,राजेन्द्र प्रसाद मण्डल केवट,पुरुष,38,स्वतन्त्र,मोरङ्ग,धनपालथान गाउँपालिका,,अध्यक्ष,13085,14,,7
4,1,नथुनी प्रसाद नुनियाँ  सिहं,पुरुष,47,"संघीय समाजवादी फोरम, नेपाल ",मोरङ्ग,धनपालथान गाउँपालिका,,अध्यक्ष,13086,1500,,4
