SerialNo,PartyID,StateID,CandidateName,Gender,Age,PoliticalPartyName,DistrictName,LocalBodyName,WardNo,PostName,TotalVotesReceived,EStatus,Rank
13087,0,1,नसीमा वानो,महिला,30,नेपाली काँग्रेस,मोरङ्ग,धनपालथान गाउँपालिका,,उपाध्यक्ष,4635,E,1
13088,1,1,उपासी राजबंशी,महिला,56,नेपाल कम्युनिष्ट पार्टी (एकीकृत मार्क्सवादी-लेनिनवादी),मोरङ्ग,धनपालथान गाउँपालिका,,उपाध्यक्ष,4421,,2
13089,3,1,विमला श्रेष्ठ,महिला,48,राष्ट्रिय प्रजातन्त्र पार्टी ,मोरङ्ग,धनपालथान गाउँपालिका,,उपाध्यक्ष,114,,6
13090,4,1,इन्द्रमणी देवी मंडल गंगाई,महिला,40,"संघीय समाजवादी फोरम, नेपाल ",मोरङ्ग,धनपालथान गाउँपालिका,,उपाध्यक्ष,2057,,4
13091,5,1,सरिता देवी सरदार,महिला,24,"मधेशी जनअधिकार फोरम, नेपाल (लोकतान्त्रिक)",मोरङ्ग,धनपालथान गाउँपालिका,,उपाध्यक्ष,393,,5
13092,2,1,चादनी कुमारी मण्डल,महिला,26,नेपाल कम्युनिष्ट पार्टी (माओवादी केन्द्र),मोरङ्ग,धनपालथान गाउँपालिका,,उपाध्यक्ष,3450,,3
