SerialNo,PartyID,StateID,CandidateName,Gender,Age,PoliticalPartyName,DistrictName,LocalBodyName,WardNo,PostName,TotalVotesReceived,EStatus,Rank
35232,0,4,सीता कुमारी काफ्ले,महिला,39,नेपाली काँग्रेस,पर्वत,कुश्मा नगरपालिका,,उपप्रमुख,8419,E,1
35233,1,4,मुवा कुमारी शर्मा,महिला,48,नेपाल कम्युनिष्ट पार्टी (एकीकृत मार्क्सवादी-लेनिनवादी),पर्वत,कुश्मा नगरपालिका,,उपप्रमुख,7023,,2
35234,67,4,"शान्‍ती पी.सि, थापा",महिला,38,"नयाँ शक्ति पार्टी, नेपाल",पर्वत,कुश्मा नगरपालिका,,उपप्रमुख,34,,5
35235,8,4,सावित्रा वि. क,महिला,46,नेपाल कम्युनिष्ट पार्टी (मार्क्सवादी–लेनिनवादी),पर्वत,कुश्मा नगरपालिका,,उपप्रमुख,43,,4
35236,2,4,तारादेवी रिजाल,महिला,29,नेपाल कम्युनिष्ट पार्टी (माओवादी केन्द्र),पर्वत,कुश्मा नगरपालिका,,उपप्रमुख,1236,,3
