SerialNo,PartyID,StateID,CandidateName,Gender,Age,PoliticalPartyName,DistrictName,LocalBodyName,WardNo,PostName,TotalVotesReceived,EStatus,Rank
5539,2,1,सुकमती राजवंशी,महिला,41,नेपाल कम्युनिष्ट पार्टी (माओवादी केन्द्र),झापा,बाह्रदशी गाउँपालिका,,उपाध्यक्ष,1731,,3
5540,0,1,रत्नाकुमारी राजवंशी,महिला,39,नेपाली काँग्रेस,झापा,बाह्रदशी गाउँपालिका,,उपाध्यक्ष,5453,E,1
5541,40,1,गंगा माया केरुङ्ग,महिला,34,संघीय लोकतान्त्रिक राष्ट्रिय मञ्च,झापा,बाह्रदशी गाउँपालिका,,उपाध्यक्ष,154,,5
5542,3,1,सौरी टुडु,महिला,30,राष्ट्रिय प्रजातन्त्र पार्टी ,झापा,बाह्रदशी गाउँपालिका,,उपाध्यक्ष,1297,,4
5543,1,1,गंगा देवी धमला,महिला,48,नेपाल कम्युनिष्ट पार्टी (एकीकृत मार्क्सवादी-लेनिनवादी),झापा,बाह्रदशी गाउँपालिका,,उपाध्यक्ष,5256,,2
