SerialNo,StateID,CandidateName,Gender,Age,PoliticalPartyName,DistrictName,CenterConstID,SCConstID,TotalVotesReceived,EStatus,Rank
2662,4,टेक बहादुर घर्ती,पुरुष,46,राष्ट्रिय जनमोर्चा,बागलुङ,2,2,11884,Elected,1
2663,4,जीत बहादुर शेरचन,पुरुष,38,नेपाली काँग्रेस,बागलुङ,2,2,8624,,2
2664,4,दिल बहादुर  वि‍ क‍,पुरुष,41,आमूल परिवर्तन मसिहा पार्टी नेपाल,बागलुङ,2,2,156,,3
2665,4,यम कुमार पुन,पुरुष,32,संघीय समाजवादी फोरम नेपाल,बागलुङ,2,2,156,,4
2666,4,टेक बहादुर कुवँर,पुरुष,49,नयाँ शक्ति पार्टी नेपाल,बागलुङ,2,2,77,,5
