SerialNo,PartyID,StateID,CandidateName,Gender,Age,PoliticalPartyName,DistrictName,LocalBodyName,WardNo,PostName,TotalVotesReceived,EStatus,Rank
7069,0,1,दिलिप कुमार लिम्बु,पुरुष,66,नेपाली काँग्रेस,झापा,हल्दीवारी गाउँपालिका,,अध्यक्ष,2915,,3
7070,1,1,मंजु देवी सिटौला,महिला,53,नेपाल कम्युनिष्ट पार्टी (एकीकृत मार्क्सवादी-लेनिनवादी),झापा,हल्दीवारी गाउँपालिका,,अध्यक्ष,3543,,2
7071,3,1,रविन्द्र प्रसाद लिङदेन,पुरुष,47,राष्ट्रिय प्रजातन्त्र पार्टी ,झापा,हल्दीवारी गाउँपालिका,,अध्यक्ष,3943,E,1
7072,2,1,तुलसी प्रसाद ओली,पुरुष,43,नेपाल कम्युनिष्ट पार्टी (माओवादी केन्द्र),झापा,हल्दीवारी गाउँपालिका,,अध्यक्ष,2117,,4
7073,8,1,गंगा प्रसाद सिवाकोटी,पुरुष,50,नेपाल कम्युनिष्ट पार्टी (मार्क्सवादी–लेनिनवादी),झापा,हल्दीवारी गाउँपालिका,,अध्यक्ष,46,,5
